date,review,rating
2013년 05월 28일,업데이트될때마다 더 편하고 더 유용하게 쓰고있어요^^ 친절한 답변덕에 롯데닷컴에 대한 인식이 완전히 뒤바뀌었구요!,5
2013년 05월 28일,디자인 심플하니 보기좋긴한데 카테고리를 누르지 않아도 쉽게 볼수 있으면 좋겠어요,5
2013년 05월 27일,"예전부터 쭈욱 사용해오던 앱이라 익숙해서 자주 들러요 주로 남성복이나 캐주얼의류를 보는데 브랜드별, 종류별로 구분해서 보기 편하고 무엇보다 연중 계속되는 기획전에서 득템을 하곤 합니다~ㅎ",5
2013년 05월 27일,쿠폰도써서 백화점보다 더 저렴하게 살수있어서 너무좋아요~ 요새 매장세일도 잘안해줘서ㅠㅠ 개선할점은 상품보낼때 사이즈를 잘확인해서보내주셨으면좋겠네요. 사이즈 오배송으로 옷 기다리는 시간이 아까워요. 번거롭고,5
2013년 05월 27일,"홈 화면이 지연되거나 ... 결제 시 오류 가 한번씩 나눔과 외에는 편리하게 잘
쓰고 있습니다.",5
2013년 05월 27일,디자인두 보기 쉽도록 잘 되어 있구요~~ 무엇보다 렉이 잘 안걸려서 너무 좋아요,5
2013년 05월 18일,"아놔 노트북 좀 살려고 했는데
어플 이모양으로 만들어놓네",1
2013년 04월 30일,쇼핑할때는 항상 롯데닷컴을 이용하는데..^^ 어플이 너무 편리하고 보기좋게 잘되어 있어서 살거 없어도 일하는 중간중간 습관처럼 들여다보게 되요...크크 그리곤 하나씩 득템을 하죠ㅎㅎ 롯데닷컴은 제 핸드폰 메인화면에.. 클낫네요 쇼핑 중독 되겟어요!ㅋㅋ,5
2013년 04월 30일,여러 소셜앱과 타할인몰 또 옥x등을 이용하지만 그중에서 롯데가 실속과 편리함이 소비자 입장에서 제일나아요 그리고 쉬워요...,5
2013년 04월 29일,백화점 상품을 쿠폰 몽땅받고 구매하는 ~이런 앱 강추합니다,4
2013년 04월 29일,구매목록 삭제 부탁드려요.,5
2013년 04월 28일,"사실 모바일 쇼핑관련앱에서 버그나 오류없이 잘 작동되는거 본적 잘 없는데, 롯데닷컴앱은 전혀 불편함 없어 너무 좋네요:) 결제까지 원스탑!",4
2013년 04월 27일,"오늘 사진 포함해서 상품평 업하려고 했다가 앱 설치하라고 해서 설치해봤습니다.
롯데닷컴은 출퇴근시 자주 보는편입니다. 막상 웹이랑 앱이랑 다를 바가 없네요 ^^;",4
2013년 04월 26일,"롯데닷컴 모바일앱은 처음 사용하는데 인터넷 구매하는 것보다 더 혜택이 큰 것 같아요... 앞으로도 유용하게 잘 쓸게요.
다만 롯데닷컴 홈페이지랑 모바일앱 장바구니가 때때로 호환이 잘 되지 않아서 답답할 때가 있었는데 차츰 수정해 주시기를 바랍니다^^",5
2013년 04월 26일,"실시간으로 달라지는 할인상품 추천상품들 때문에 매일같이 방문하게됩니다
믿을수있는 롯데의 유통시스템! 사후관리시스템덕에 쇼핑할맛이나네요",5
2013년 04월 26일,앱로딩할때 현재시간뜨는게 너무 이쁘게 디자인되서 리뷰남기네요ㅎ 오랜만에 들어갔는데 기분좋아지는 디자인의 앱~!,5
2013년 04월 26일,"오늘 업데이트 했습니다만
여전히 상품 검색할때 카테고리 설정하고, 원하는 브랜드도 설정하면 이전에 설정한 카테고리가 해제되네요 즉, 원하는 구체적인 상품군이 안 나오고 모든 상품이 다 검색된다는거지요",4
2013년 04월 26일,버스나 지하철에서 간편하게 쇼핑할수 있어서 좋아요,5
2013년 04월 25일,백화점을 인터넷으로! 또 롯데닷컴 앱으로 편리하게 스마트폰으로! 이번에 여자친구 생일선물 구매했는데 정말 편리했습니다.,5
2013년 04월 25일,매일 찾아오게 만드는 롯데닷컴 앱!! 쿠폰도 많아서 좋아요. 그리고 문자로 1:1문의하기도 있음 참 좋을 거 같아요~,5
2013년 04월 25일,좋아요^^편리합니다,5
2013년 04월 24일,"앱 업데이트중 최악입니다
오히려 조잡한 메뉴들이 많아졌고 한눈에 들어오는 특가상품이나 그날의 상품등이 한눈에 안들어와요 그 전 버전 앱이 참 좋았는데 심지어",5
2013년 04월 24일,ㅎㅎ 이벤트도 푸짐하고 정말 사고 싶은 상품들도 많고 그리고 이것 저것 상품들 보기 편하네요. ^^,4
2013년 04월 24일,화사하고 영해진 느낌이네요 칙칙한 건 버려 좋은데 속도 좀 빨라졌음 좋겠어요,5
2013년 04월 24일,보기편해서자주들어오게되네요,4
2013년 04월 23일,몇년째 롯데닷컴어플을사용하고있어요~ 다른 쇼핑몰 어플보다 정말사용하기 편하고 여러가지 이벤트도 많아요 진짜 롯데닷컴어플쓰다가 다른 쇼핑몰어플은 불편해서 못쓰겠어요 느낌아닌깐~~,5
2013년 04월 23일,"아이폰 경품 응모한데서 어플 다운받고 응모하기 누르면 모바일앱에서만 지원된다면서
모바일앱-앱스토어 무한 반복 ㅡㅡ;; 모바일 회원가입도 창이 가려져 가입하는데도 시간 엄청 잡아먹었는데..... 응모하기 안되면서 응모로 낚는 건가요?",4
2013년 04월 23일,"롯데닷컴이 타사에 비해 뭔가 사고싶게생긴게많음 ㅋㅋ
메인화면이 좀 덜복잡하고 이미지가 컸음 좋겠음",4
2013년 04월 23일,나름. 깔끔하고. 특가제품도 많고. 좋네요,3
2013년 04월 22일,"롯데 닷컴이라 믿고 살 수 있다는 점, 백화점보다 저렴하게 할인받아서 살 수 있는 제품들이 있다는 점에서 자주 이용하고 있어요 ~~ 열심히 출석이벵해서 무료배송권도 받고 ㅋㅋ굿굿굿!",4
2013년 04월 22일,이벤트가 많아서 각종 혜택을 누릴수있어 좋아오~~ 하루 한번 꼭 들어가서 출석체크해서 클로버도 받구 ㅎㅎ,5
2013년 04월 22일,간편하고 보기 좋아서 쇼핑할맛 나네요! 할인쿠폰도 더 지급해줘서 더 좋아요!,4
2013년 04월 22일,짜증나서 안살게요 앱깔면모함 ㅋㅋ시계에서 안넘어가고 계속튕김 여러번재설치했는데 시계만보다가 내가이딴데다 시간을 이렇게썼나하고 화가나서 삭제함 앱 아예없애면 좋을듯 어차피 사용못하니깜,5
2013년 04월 22일,구매목록 삭제 해주세요,4
2013년 04월 21일,"롯데 앱 덕분에 쇼핑하기도 간편하고 시간과 장소를 구애받지 않으니 아이 키우면서도 지름신 강림... 다른 사이트보다 저렴한 물건, 백화점에 가지 않아도 할인해서 구입 할수 있어 자주 이용해요... 무엇보다 믿을 수 있네요...다만 할인쿠폰 쓸 수 있는 선택의 폭이 넓어졌으면 좋겠어요... 못쓰는 쿠폰이 많이 있어 아쉽더라구요...ㅠㅠ",5
2013년 04월 21일,신상품들을 모바일로 바로 구매할 수 있어 굉장히 편하고요 쿠폰 이벤트가 다양해서 가격면에서도 훌륭하네요,5
2013년 04월 21일,모바일로 구매하니 포인트도 적립되고 좋아요. 현대 M포인트 사용이 가능하면 더 좋을것 같네요. ^^,3
2013년 04월 21일,일하면서 쇼핑하러다니기 쉽지않앗는데 좋은 제품을 저렴한가격에 살수있다니 너무 좋습니다^^,5
2013년 04월 21일,편리하니 너무좋아요 빨리 바로바로 모바일에서도 할수있어서 좋네용ㅎ,2
2013년 04월 21일,더 쉽게 쇼핑할수있고 혜택도 많아서 좋으네여~,5
2013년 04월 20일,see title !,5
2013년 04월 20일,굳,5
2013년 04월 20일,모바일특가를 첫페이지에서 다양하게 보여줘서 흥미롭네요. 모바일쇼핑만의 차별화된 혜택들도 기대해봅니다,5
2013년 04월 20일,"롯데닷컴 메뉴 구성도 잘해놓고, 가끔씩 이벤트도 있어서 즐거움을 주네요^^
그런데 모바일 주문할때 약간 오류날때도 있어요 그점 보완이 필요할것 같아요!!",5
2013년 04월 20일,하루에 수십번씩 휴대폰으로 롯데닷컴을 들락날락합니다. 쇼핑하기 편하게 되어있어서 언데 어디서든 구매할 수 있어서 완전 조아요~,4
2013년 04월 20일,ui가 깔끔합니다 그렇지만 연동문제는보완해야할것 같아요,5
2013년 04월 20일,저만 뜨는 오류인가요? 빨리 해결 좀 해주세요.,5
2013년 04월 20일,구매목록 삭제부탁드립니다,2
2013년 04월 19일,"롯데닷컴 아이디:papaeyes

롯데닷컴 주로 이용해서 모바일앱으로도 쭈욱~사용해왔어요. 이번에 깜짝알림이 추가되면서 놓칠 수 있는 할인 아이템 정보를 받아볼 수 있어 편리한 거 같아요. 메뉴 인터페이스도 이쁜 파란색으로 눈에 확 잘 띄고요. 웹보다 모바일에서 구매시 할인률과 적립율이 높아서 모바일로 구매를 자주 하는 편인데 아쉬운 점은 아이템 페이지 전환시 로딩속도가 타 쇼핑엡에 비해 느려요. 소비자들은 많은 쇼핑아이템이 쏟아지는 요즘 세상에 빠르고 편하게 원하는 아이템을 쏙쏙 클릭해서 구매하길 원하는데 모바일앱에서 속도가 좀 느리고요. 쇼핑아이템을 클릭하고 상품정보를 본 후 이전페이지로 넘어가면 쇼핑화면 스크롤이 처음 상태로 돼 다시 처음부터 쇼핑목록을 봐야하는 불편함도 있어요. 그래서 다시 스크롤이나 다음목록으로 일일이 눌러야하는 번거로움에 킬링타임이 좀 있어서 이점 개선된다면 무척 편하고 좋을 것 같아요^^",5
2013년 04월 19일,평소에 인터넷으로 롯데닷컴을 많이 이용해왔는데 어플로 만들어 진 뒤 편리하게 사용하고 있습니다. 어디서든지 핸드폰으로 롯데닷컴에서 내가 사고싶은 것을 쉽게 구매할 수 있어서 좋아요. 결제시스템도 굉장히 편하구요. 매달 이것저것 주는 쿠폰과 이벤트 등으로 저렴하게 구입할 수 도 있어서 좋습니당+_+,5
2013년 04월 19일,"가끔 화면이 전환되면 꺼지는
오류가 있기는 하지만 다른 홈쇼핑 앱에 비하면 오류가 적은편입니다! 화면전환도 빠르구요! 더 많은 할인혜택만 주워진다면 좋을것 같습니다!",5
2013년 04월 19일,"롯데앱에서 그동안 눈여겨보았던 르쿠르제 접시 샀어요 ㅠㅠ 쿠폰도 빵빵하구 좋아요 ^^
백화점에선 아이쇼핑만 하게되네요 ㅋ",5
2013년 04월 19일,"화면이 큼직하니 상품들 보기도 편하고 쇼핑하기 편리해요
요새 홈페이지보다 모바일쇼핑이 더편한거 같아요
할인혜택도 많은거 같구요",5
2013년 04월 19일,"결제도간편하고 할인도 많이되고 빠른배송까지~~!!
득템이에요^^",4
2013년 04월 19일,항상 이용하는 롯데닷컴을 모바일로 빠르고 편하게 이용할수 있어서 너무 좋아요. 앞으로 많이 이용할께요.,4
2013년 04월 19일,UI가 편하고 밝아서 맘에 들어요. 다만 좀 더 모바일에서할 수 있는 이벤트 등이 많으면 더 자주 들어올 것 같네요,5
2013년 04월 19일,"매일 한번씩 들어와보는 롯데닷컴 앱
쇼핑하기도 편하고 좋은상품들 구경하기도 좋고~~~!",4
2013년 04월 19일,"편하고 좋네여 ㅋㅋㅋ에러도 없고
쇼핑하기도 편하고
여러가지 이벤트도 많아서 좋네요
특히 기획상품같은건 면세보다 더 싸게 살수있어서 좋아요",5
2013년 04월 19일,"여기서 물건여러개사고 그중하나 반품했더니 반품금액 10만원을 부분취소가 안된다며 바로 포인트로 묶어버리네요
대기업답네요..",5
2013년 04월 19일,"롯데닷컴 앱에 대한 솔직한기
<기능>
자주쓰는 배송메세지가 생기면서 구지 입력하는 번거로움이 없어져서 정말 좋은거 같아요 이런 사소한 거 까지 신경써주는 부분이 고객으로 하여금 한번더 찾게되고 꾸준히 이용하는 비결이 아닌가 생각이 됩니다",4
2013년 04월 19일,"너무너무 편리해 졌어요~~
항상 이용한답니다 ^^
이벤트도 많이 하고 응모도 많이하고 ㅋ 좋아요 ~~",4
2013년 04월 19일,"컴터로 하는것다 더 쉽고 빠르게 볼수잇어 넘 좋아요~~
더더욱 간편하구요~^*^",5
2013년 04월 19일,이용하기 편하게 되어있어요 깔끔해서 원하는거 찾기도 쉽구요.. 웹 이용시 혜택도 많이 있어서 자주 방문하게 되네요,5
2013년 04월 19일,"대학교 신입생인 나에게는 롯데닷컴은 정말 필요한 앱이다.
롯데닷컴 앱을 통해서 작은 휴대폰 화면속에 나는 큰 백화점에 있는것 같은 기분이 든다.
내가 좋아하는 전자기기 그리고 여자친구가 좋아하는 의류 및 잡화 등 카테고리의 정렬이 한눈에 들어와 마음에 든다.",5
2013년 04월 19일,"처음에는 잘 되다가 좀 지나면 갑자기 어플이 작동이 안되여ㅠㅠ

여러번 다시 깔고 사용해봐도 반복 될뿐이고,,,,
이거 업데이트 좀 하세요;;",4
2013년 04월 19일,"바로 주문이랑 위시리스트만 있고
장바구니가 없어요
그때그때 주문하라는 건가요ㅠㅠ",5
2013년 04월 19일,"빠르고 결제까지 되니 편하네요

개인정보 수정도 가능하면 좋겠네요 ㅎ",4
2013년 04월 19일,쇼핑이 정말 편해졋어요. 이젠 롯데닷컴 앱으로 쇼핑하세요.,4
2013년 04월 19일,쇼핑도 편리하고 상품 찾기도 쉽고 아주 좋네요,4
2013년 04월 19일,회사에서 간편하게 사용해서 편해요,3
2013년 04월 19일,지금 장바구니 열면 어플이 계속 멈춰요,5
2013년 04월 19일,"장바구니에 넣어둔거 다 지우고 뭐하는 짓인지...
내등급 밑바닥으로 쳐 내리고, 불매 들어감.",2
2013년 04월 19일,"며칠 전까지민해도 검색어 입력하면 그에따른
물품들이 쫘르륵 다 떴는데
이번버전은 검색어가 포함되도 물품이 안나오고
누락되기 일쑤네요",5
2013년 04월 18일,매일매일 들어가 봅니당ㅎ 롯데닷컴 어플 좋아요 잘 쓰고 있어요ㅋ,5
2013년 04월 18일,"왜 아이콘 눌렀는데도 계속 튕기고
실행이 안되는 거예유 ? 왜 이란당가요?살거이 많은디 싸게 싸게 좀 고쳐불더라고ㅠㅜ,
놋데가 돈도 많은디 앱개발은 강생이 발로 했나벼.....",4
2013년 04월 18일,언제 어디서나 백화점 상품을 찾을 수 있고 모바일만의 특가가 있어서 좋다.,4
2013년 04월 18일,용량때문에 구매내역 삭제부탁합니다 ㅜ,5
2013년 04월 18일,용량부족해서요 구매내역삭제 부탁드려요,5
2013년 04월 18일,아이폰 용량이 부족해요. 구매내역 삭제 부탁드립니다.,5
2013년 04월 18일,"고객님, 안녕하세요. 롯데닷컴입니다.",5
2013년 04월 18일,화면 구성은 보기 편하게 괜찮네요,5
2013년 04월 18일,구매내역 삭제 부탁드립니다,4
2013년 04월 18일,짱짱조아용,4
2013년 03월 29일,오래전부터 롯데닷컴 어플을 이용해왔는데 점점 진화하는게 눈에 보이네요^^ 전에는 기능도 별로 없어서 PC를 켜서 확인해야하는 경우가 많았는데 이제 웬만한건 어플통해서 확인할 수 있어 짱 편해요^^,4
2013년 03월 29일,솔직히 이런글 잘 안쓰고 속으면 걍 속았다하고 지우는데 이건ㅋㅋ페이스북에서는 1+1이라면서 파는것처럼 앱연결되게 깔게 시키더니 막상 라이언인형 검색하니깐 진짜 사자인형ㅋㅋㅋㅋㅋㅋㅋ...완전 뒤통수 쎄게 때리시네요 일시적으로 앱깔게하려는 광고 진짜 극혐입니다 관계자분 제발 보고 이렇게 속이지마세요,5
2013년 03월 29일,"아이폰 6s사용자 입니다. 결제페이지에서 하얀화면만 나오고 넘어가지를 않아요 짜증나네요
빠른 조치 부탁드립니다",4
2013년 03월 29일,컴퓨터를 부팅할 필요가없고 결재도 편하고 아주 편리해요 ㅎㅎ,3
2013년 03월 29일,"주문,배송,문의사항까지 알아보기 참 편해요",3
2013년 03월 29일,"일단 간편하게 잘 되어있고
검색이나 상품상세조회등이
편리해서 너무 좋은것 같아요.
앞으로 더 발전하는 롯데닷컴",5
2013년 03월 29일,어플 다운했는데 왜 카드에서 돈이 빠져나가죠????,5
2013년 03월 29일,구매내역 삭제 부탁드립니다.,4
2013년 03월 28일,일단 앱을 통해 여러상품들을 편하게 쇼핑할 수 있다는게 좋아요~~ 대게 다른 앱들은 앱이 잘 끊기고 앱을 통해 살수있는 상품이 한정되있는데 롯데 앱은 상품도 알차고 쇼핑하기 너무 좋네요!! 그리고 무엇보다 앱을통해 싸게 살수있다는 것!!!! 이벤트를 많이 해서 싸고 재밌게 쇼핑할수있어 좋아요!! 앱을 안지 얼마 안된게 아쉬울뿐..ㅠ 매일 중독처럼 앱열고 쇼핑하게 될까봐 걱정도 되지만;;; 앞으로 많이 이용하게 될것 같은 예감^=^!,5
2013년 03월 28일,콤퓨타 안켜도 되고 전기도 절약되고!! 일석이조! 앱으로 주문하니 편해요<~^^항상 이용하고 있어요! 처음보다 갈수록 진화하네요~ 불편한 점 별로 못느끼는데..,5
2013년 03월 28일,와..!!컴퓨터로만 롯데닷컴을 이용하다가 모바일앱으로 접해보니 완전 신세계네요!!!그냥 침대에 누워서도 쇼핑할 수 도있구~~완전 편리하네요 롯데닷컴 모바일앱이 널리 알려져서 많은 사람이 썻으면 좋겠습니다,5
2013년 03월 28일,앱업데이트 너무 자주해서 들어올때마나 너무너무너무너무 귀찮습니다.. 발전하려는거는 좋은데 무슨 2주에 한번씩 앱업데이트하라고 뜨는데.. 실상해보면 딱히 바뀐것도 없고.. 뭐하는건지 지우고싶네요진심 들어오기 점점 짜증남.. 업데이트하라고하면 꺼버리는데 해도해도 너무한거같아서 리뷰 쓰러들어왔네요;;;;; 제발 그만좀하세요그만좀!!!!!!!!!!,5
2013년 03월 28일,보기도 편하고 이용하기도 편해요. 지난주에 이걸로 처음 봄점퍼 샀는데 인터넷으로 산거랑 똑같이 빨리 왔어요ㅎㅎ,4
2013년 03월 28일,다만 몇가지 수정해 편리하게 이용 가능하겠네요. 로그인이 없네요,5
2013년 03월 28일,"쇼핑을 하라고 만든건지, 여기서 쇼핑하지 말라고 만든건지,,, 최악이다, 렉도 심하고 이전으로 되돌아가기하면 처음으로 되돌아간다",3
2013년 03월 28일,구매내약삭제부탁드립니다,5
2013년 03월 28일,구매목록 삭제 부탁드립니다.,4
2013년 03월 27일,앱은 언제나오나 기다렸는데 드디어 나왔네요! 첫 인트로의 블루컬라가 깔끔하고 고급스러운 느낌을 줍니다. 스마트 뷰로 상품을 한 눈에 볼 수 있어 쇼핑하기 참 편합니다. 카드도 미리 입력 해놓으면 중복 입력안해도 되는 번거로움이 없어 편리하고 좋습니다! pc웹보다 자주 애용하게 될 것 같아요.,5
2013년 03월 27일,쇼핑몰 앱들 중에서 사용하기 편한 쪽에 속합니다! 이전화면으로 넘어가는 기능이 좀 약해서.. 상품 보고 이전 화면으로 넘어왔을때 원래 보고 있던 페이지가 아닐때가 종종 있어요. 그거 외에는 굿,5
2013년 03월 27일,"사용하는데 별로 나쁘지 않고,편리하네요.그런데 앱에서 쿠폰 사용도 가능하게 해주시면 더 좋을것 같나 요.",5
2013년 03월 27일,"내가 본 상품다시보기가 잘안되네요

다른건 전체적으로 별문데없어보입니다

할인받을수있는점도 좋구요",5
2013년 03월 27일,할인 카테고리가 두개인데 할인률이 높은 쿠폰을 선택하면 다음 카테고리에서는 할인룰이 낮은 쿠폰밖에 서택할 수 없어요 마치 모바일 구매시 혜택이 더 많은 것처럼 써서 앱 깔게고 정말 쓸모없네요,4
2013년 03월 27일,롯데닷컴 자주 이용하는데 이렇게 간편하게 사용할수있는앱이 있어서 더욱더 편리하네요,4
2013년 03월 27일,"플래티넘 플러스 항상 유지해 왔고
불편한 상황이 초래돼도 그냥 그러려니 했음.
상품이 오배송이 왔는데 그 상품에 직원이 색상만 다르니 그냥 써라 상큼하게 손메모를 상쾌하게 써주었을때도 화는 나지만 직원이 매장응대 교육을 안배웠겠지해서 온라인cs에 정중히 반품요청만하면서 넘어갔지만 이런일이 한두번이 아니였음. 그냥 고객을 기만하는 행위를 일삼는 거임 백화점 매장 직원이든 콜씨에스직원이든 온라인직원이든. 지금도 닷컴 꼭대기 등급고객들 일반회원만들어 놓고 미안데헷><*",3
2013년 03월 26일,어디서 어떤 상품을 봐도 항상 롯데닷컴에서 상품정보를 보다 쉽고 정확하게 확인하게 됩니다 백화점 굳이 가지 않아도 좋은 물건 더 좋은 가격에 만나게 되니깐 진짜 자주 찾게 되네요,4
2013년 03월 26일,"제 컴퓨터가 매킨토시라 인터넷 쇼핑, 결제가 불가능 했었는데 롯데닷컴과 롯데홈쇼핑 어플을 통해서 너무 손쉽게 쇼핑이 가능해졌어요.! 항상 애용합니다 :)",5
2013년 03월 26일,"오늘 다운 받아서 상품 구매하려고 하는데 전 좋네요 ㅎ 모바일앱 혜택도 있고!
상품구성이 깔끔해서 한 눈에 보기도 좋은 거 같아용~~",4
2013년 03월 26일,항상 롯데닷컴 이용하는데 이제 모바일로 하니 더 가까이 편리하게 이용할수 있어좋아요 모바일 혜택도 많고 많이 사랑해주세요,5
2013년 03월 26일,"한번에
볼 수 있고 할인혜택이 많아서 좋은거 같아요!!",4
2013년 03월 26일,사이트 일부러안드러가도 되공 간편하게 어플이 잇어서 너무좋다 쇼핑하기도편하고,4
2013년 03월 26일,"몇분기 연속 플래티넘일 정도로 롯데닷컴 이용 많이 하는데, 대체 왜 이렇게 불편해진 건가요?
모니터 안 해요?? 얼른 수정해주세요!! 업뎃하고 하루 이틀 지난 것도 아니고, 버그 수정 안 합니까??",3
2013년 03월 26일,편하고 좋아요 모바일구매시 추가할인도 있어서 잘 사용하고있습니다,4
2013년 03월 26일,이젠 스마트하게 아무때나 편하게 롯데에 올수 있어서 좋아요,4
2013년 03월 26일,용량으로 인해 구매내역 삭제 부탁드려요~😄,4
2013년 03월 26일,구매내역삭제요청드립니다,4
2013년 03월 26일,지금까진 이벤트 많아 조아요 잘쓸에요 ㅎㅎ,4
2013년 03월 26일,^^,5
2013년 03월 25일,구입도 쉽고 백화좀보다싸요. 단지 배송이좀느리고 구입한제품이 품절이라고 갑자기 안온다거나해서 황당할때가있네요. 없음팔질말던가,4
2013년 03월 25일,진짜 어플 갲같이 만들었다 뭔 오류가 이렇게 많고 느려 터져서 답답해 디지겠다 결제도 안됨,5
2013년 03월 24일,깔끔해지고 간편해진거같아서 좋은거같아요 그리고 전보다 빨라진듯한 느낌도 들구요! 앱을통해 구매시 할인혜택이 더 커졌으면 좋겠어요!! kiss1787,5
2013년 03월 24일,"편리하고 빠르고 좋아요
잘 사용하고있습니다
클로버 적립도 할수있고 다양한 이벤트
참가하는것도 쉬워서 매일 사용하고있어요",3
2013년 03월 24일,속도도 빠르고 무엇보다 하단 메뉴가 있어 너무 편하게 이동할 수 있어요. 정리도 잘 되어 있고~ 좋습니다!,5
2013년 03월 24일,피곤할때 누워서 쇼핑하니 참 편하더라구요 쿠폰으로 저렴하게 잘 샀어요,5
2013년 03월 24일,평소 롯데에서 인쇼를 좀 하는편이 었는데 모바일 혜택도 많구 좋네요~ 만족!ㅋ,4
2013년 03월 24일,"모든 쇼핑을 롯데닷컴에서 합니다~^^
쪼금 더 저렴하다 여기저기 분산이용하면 포인트적립도 분산되고~ㅎㅎ
롯데닷컴 항시 여러 이벤트로 포인트적립은 최고인 것 같아요~~ 이벤트 상품도 기간만 잘 맞으면 득템의 기회도 많구요~",4
2013년 03월 24일,원래도 불편했는데 이젠 쓸 수도 없게 만들어버렸네여ㅜㅜㅜ,5
2013년 03월 23일,"다른 어플,사이트 이용 안하고 롯데 닷컴만 이용하는데 신뢰할 수 있어서 너무 좋네요",4
2013년 03월 23일,백화점에 굳이 가지 않아도 믿고 살수잇는 닷컴~ 푸싀알림으로 이벤트 수시로 확인가능. 저렴하게 잘 이용하고잇습니다,5
2013년 03월 23일,푸시 수신거부 한지가 2일째인데 계속 알림이 오잖아요 제발 수정좀해주세요 가뜩이나 어플에서 1뜨는거 안없어져서 알림거부했는데 지속 동일현상이 발생되면 어쩝니까 좀 푸시 보내실때 대상자 관리나 마케팅수신동의 잘되잇는지 확인좀하세요,4
2013년 03월 23일,스마트하게 쓸 수 있어 너무 좋네요.,5
2013년 03월 23일,속도도빠르고 할인도많구,5
2013년 03월 22일,언제오디서든 손 쉽게 찾을 수 있어서 좋습니다,5
2013년 03월 22일,"간편한것도 그렇고
다른곳보다 제품도 많고
가격도 괜찮음",4
2013년 03월 22일,이벤트 상품 뿐 아니라 전체 상품이 보기 편하고 적립이 잘 되는 거 같아요^^,4
2013년 03월 22일,제품 정보와 할인 소식을 빠르게 알 수 있어 쇼핑이 더욱 편해졌어요.,3
2013년 03월 22일,"컴으로도 맨날들어갓었는데
모바일앱이 있어 더많이 들어가게되네요.
모바일쿠폰이 더욱맘에들고요^^
다만쿠폰적용안되는건 pc에서럼 보일수있게",5
