date,review,rating
2016년 02월 03일,온라인보다 모바일에서 매달 쿤 할인혜택이 있어 비싼 물건은 모바일로 꼭 구매하고 있어요,1
2016년 02월 03일,가입절차도 더럽게 복잡하고 내가 해볼려고 노력하다 욕마와서 지운다 ㅡㅡ 비번부터 짜증나게 어렵게하라고하고 도로명주소 뭐 되도 않네 평가 가치도없어 쓰지마,1
2016년 02월 03일,모바일 혜택이 많아서 좋은거같아요~~,1
2016년 01월 31일,리뷰잘안쓰는데…좋아이건 ‌,3
2016년 01월 28일,"상품을 자세히 보려면 다시 클릭하고 다시 찾는게 번거롭네요
시간과 장소에 구애없이 구매 가는하다는 점은 편리해서 좋아요",3
2016년 01월 28일,"시간 절약되고 편하고 좋네요
속도도 빠른편이구요",1
2016년 01월 28일,돈 안아깝냐?,5
2016년 01월 27일,등록중입니다 계속 멈추고 진행이 안되네여,1
2016년 01월 26일,구매내역 삭제 해주세요,1
2016년 01월 24일,부탁드립니다,3
2016년 01월 22일,"언제 어디서나 생각날때 검색해서~
쿠폰에~적립금까지 사용해서 싸게 물건을 살수있어서 좋아요. 롯데라서 믿을수도 있고요^^ 더 좋은 상품을 더 많이 만날수 있었으면 좋겠어요~",1
2016년 01월 22일,"롯데훼미리 통합아디로 이용잘하고있는 고객인데
주로 스마트폰으로만 쇼핑을한다
롯데에서 가장 많이 구매하지싶다
선물할것은 주로 롯데닷컴을 이용하는데",1
2016년 01월 22일,사용하기 편해요~,1
2016년 01월 21일,"고객님, 안녕하세요. 롯데닷컴입니다. 먼저, 쇼핑에 불편을 드려 죄송합니다. 최근 롯데닷컴에 대량의 디도스 공격이 지속적으로 들어오면서 해외 IP/국내 일부 IP 차단 대응으로 인하여 고객님께 불편을 드린 점 양해 부탁 드립니다. 고객님께서 롯데닷컴에 접속하신 위치가 해외가 아닌 경우라면, 기기를 재부팅한 후 접속 시 새로운 IP로 접속하게 되므로 정상 서비스를 이용하실 수도 있습니다. 최대한 빠른 시일 내에 정상 서비스를 제공할 수 있도록 노력하겠습니다. 다시 한 번 쇼핑에 불편을 드려 죄송합니다.",1
2016년 01월 20일,너무나 추천드립니다 ~‌,1
2016년 01월 17일,"평소에 롯데닷컴을 자주 이용하는데요, 지하철이나 회사에서도 짬짬히 쉴때 마다 간편하게 감색하고, 필요한물건도 바로바로 구매할수 있어서 정말 정말 좋습니다^^ 결제할때 보완도 잘되어있고, 검색도 빠르고, 모바일에서 주문하고 매장에서 바로 사용도 되고 최고네요!!^^;",3
2016년 01월 17일,종종 롯데닷컴 이용해 쇼핑하는데 이제 앱으로 더편하게 이용할수 있는거 같아요,2
2016년 01월 17일,"매번 네이버 검색해서 쓰다가
앱깔면 좀 편한가 해서 깔았어요
로그인 매번 안해도 되고
앱카드 쓰니까 결제도 빠르게 되네요",5
2016년 01월 15일,"앱 구성은 대체로 잘 되어 있는 것 같아요~
다만, 저만 그런지 몰라도 다른 앱보다 페이지 로딩속도가 다소 늦은 듯... 이점만 개선된다면 좋은 쇼핑앱이 되겠네요~^^",4
2016년 01월 15일,모바일에서 주문할때 isp로 결제할 수 있어서 편해요. 핫딜올라 왔을때 유용해요,4
2016년 01월 15일,"결제하거나 장바구니 가면 쇼핑에 불편드려 죄송하다는 오류 다시깔아도 오류
미치겠어요",5
2016년 01월 15일,구매목록 좀 삭제해주세여ㅠㅠ,1
2016년 01월 15일,너무 편하네요  ‍  ‌,1
2016년 01월 14일,"오늘의 특가는 뭔가 궁금해서 매일 들어가 보게 됩니다*^^*
이것저것 쿠폰 사용하면 물건 싸게 살 수도 있구요
바로 결제 되니 엄청 편리하구요
배송 조회도 바로바로~~~",4
2016년 01월 14일,아침마다 들어가게 되는 롯데닷컴 앱!!! 쇼핑 앱중 단연 최고죠. 간편 결제 기능이 역시 굿굿굿^^,3
2016년 01월 12일,"굳이 컴퓨터 안켜도 되서 그런지 자꾸 손가락이 롯컴 앱으로 눌러지네용ㅋㅋㅋ간편하고 빠르고,또 앱을 통해 구매하면 모바일 할인쿠폰도 더주니 진짜 구매할맛나용^^",5
2016년 01월 11일,괜찮았아요 근데 이제 안쓰게되서요ㅠ 지워주세요 어플 삭제가 안되요,1
2016년 01월 10일,"사용하기에 너무 편해요~~
가격도 좋게 나오네요~~",1
2016년 01월 10일,컴퓨터 키지 않아도 구매할수 있어서 좋아여ㅋㅋ 조잡하지 않아서 좋아요 ㅋㅋ 저렴하게 구입할 수있어 좋아요 ㅋㅋ 다 좋아요 ㅋㅋ,5
2016년 01월 09일,웹에선 컴퓨터가 좀 버벅거렸는데 스마트폰으로 간편하게 쇼핑할수있어서 좋으네요~,1
2016년 01월 08일,쭉 둘러봤는데 앱 괜찮네요. 요새 쇼핑몰 앱들이 많이 좋아지고 있네요. 롯데닷컴 앱도 깔끔하고 현재는 이벤트도 있어서 굿~!,1
2016년 01월 08일,대체 이 에러는 언제 수정하려는 건가요? 업데이트를 몇번을 해도 전혀 개선이 안 되고 있네요.,1
2016년 01월 06일,검색하기도 편하고 모바일만의 혜택도 쏠쏠합니다. 다만 카드결제가 제한적인게 아쉽네요.,1
2016년 01월 06일,뒤로 가기 눌러서 목록으로 돌아가면 맨 위 아이템부터 다시 떠요 ... -_-,1
2016년 01월 05일,삭제부탁드려요,1
2016년 01월 05일,너무 좋네요!‍‍,5
2016년 01월 05일,최고인거 같아요 !!‍,1
2016년 01월 04일,이거 유료어플 아니지 않나요??왜 결제가 이루어지는건가요?유료인가요??,1
2016년 01월 03일,"다 좋은데 첫화면 마네킹에 세팅된 옷이 좀 촌스러워요, 더 세련되게 광고할 수 있을텐데 아쉬워요",1
2016년 01월 02일,늘 바쁘고 제대로 백화점가서 쇼핑즐길 여유마저 없는 아줌마 들에게 언제어디서나손쉽게유일한 쇼핑의즐거움을 만끽하게 해주는 롯데닷컴 ㅋ 저번보다 차츰 개선되어가며 편리하게 보완된점이많아 더 자주 피씨보다모바일을 즐겨 사용하게되네요,1
2016년 01월 01일,용량이 부족하여 구매내역 삭제 부탁드립니다.,1
2015년 12월 31일,"모바일이용시 더 많은 혜택을 주세요~
아무래도 컴퓨터보다 제약이 있으니 구매나 방문 시 더 많은 혜택을 줘야한다고 생각합니다
문자와 연계해서 바로가기 주소로 이동이 쉽게 하면 금상첨화겠죠?",1
2015년 12월 31일,인터넷보다 저렴하게 물건을 구입할 수 있는 기회가 있어서 좋아요!!!,1
2015년 12월 30일,"상품검색도 결제도 안되고
스마트위시에 담은건 롯데닷컴 피씨버전에서 호환도 안되니
결국 피씨켜서 새로 찾아야하네요.
이렇게 필요없는 쇼핑어플은 처음봤어요.",4
2015년 12월 30일,며칠전 업뎃한 이후 주문이 안됩니다. 주문하기 누르면 실행이 안되고 멈춤. 빨래 조치 취해주세요,1
2015년 12월 29일,구매내역 삭제 부탁드려요ㅠㅠ,1
2015년 12월 28일,주문을 하려고해도인되니딥딥하ㅔ요,3
2015년 12월 27일,"디자인 바뀐 뒤론 한 번에 실행되는 경우가 거의 없네요
메뉴 누르고도 한참씩 기다려야 하고...
화려한 기능이나 애니메이션 효과 필요없으니
모바일에서 사용이 편하게",1
2015년 12월 25일,용량이부족해요,1
2015년 12월 23일,"업뎃하고 화면도 안보이고.. 답답해 죽겠네요~!!
이전에 편했는데.. 왜 굳이 업뎃을해서..
빨리 처리해주세요~!!!!",1
2015년 12월 23일,어플 잘만든듯 ㅎㅎㅎ 앞으로 이벤트 마니해주세요~,1
2015년 12월 23일,복잡한 것 없고 그냥 편하게 쓰고 있어요,1
2015년 12월 23일,"뭐 이딴게 다 있지

플래티넘 호갱님 어플 삭제합니다 ㅃ2",2
2015년 12월 22일,모바일이라 접속이 쉬워 자주 들어오게 되는거 같은데 모바일특가나 기획전들이 마니 없는듯해요~ 또 상품리스트보다가 어이없게 메인으로 넘어가기도 하구요~상품 보기가 좀 불편합니다~,1
2015년 12월 22일,^^ 우선 모바일 쓰면 할인율이 높아요!!! 쿠폰도 많구요!!! 강추강추!!!,1
2015년 12월 22일,앱으로 쇼핑할 수 있어서 간단하고 편리해요 !!,1
2015년 12월 22일,이벤트도 많고,1
2015년 12월 22일,"구매내역 삭제 요청드립니다.
감사합니다.",1
2015년 12월 22일,구매내역삭제부탁드립니다,5
2015년 12월 20일,결제 화면이 한시간째 로딩중..,1
2015년 12월 20일,응원하겠습니다! ‌ ‍ ‍ ‌,3
2015년 12월 19일,사용안해요,3
2015년 12월 15일,특가상품들 퇴근하고 오면 싸이즈 다 빠지는데 그때그때 확인가능해서 좋아용~~,1
2015년 12월 10일,넘 좋아요 저렴한가격에 좋은 상품 자주 득템하고 있어요,1
2015년 12월 10일,구매내역 삭제해주세요,1
2015년 12월 10일,"뭐만 검색하면 검색결과없다고 하고
답답해죽겠네여",2
2015년 12월 09일,구매목록 삭제해주세요,3
2015년 12월 07일,용량 부족으로 인하여 삭제조치 바랍니다!!!,5
2015년 12월 07일,사이트에서 결제가안되서 어플 깔았는데 나보고 또 업데이트를 하래 ㅗㅗ 니네가 제대로 만들어야지 방금 새거 다운받았는데 무슨 업데이트를 해 장난치냐? 왜 사람을 귀찮게해 짜증나게,1
2015년 12월 07일,업데이트후 앱 실행하면 튕겨나와요... 사람들 연말연시에 쇼핑할거 많을텐데 왜 이런 기능체크도 안된 버전업을 한건지?!!,1
2015년 12월 07일,화면도 안뜨고 버벅거려요 ㅠㅠ 이전 버전이 낫네요 ㅠㅠ,2
2015년 12월 04일,구매내역 삭제조 해주세요,1
2015년 11월 30일,아이폰6 사용잔데 결제하려고 들어가면 화면이 안뜨네요 네이버에서 들어가도 결제하려고 결제하기 버튼 누르면 네이버 앱 꺼집니다 업뎃해도 소용이 없네요 빨리 고쳐주세요 넘 불편합니다,1
2015년 11월 28일,업뎃을 안해서 로딩이 안되나했더니 업뎃해도 똑같음..결국 어플이 거지같은거,1
2015년 11월 20일,결제되는것도 곧업뎃한다지요??? 기다리겠습니다 ㅋㅋㅋ,5
2015년 11월 18일,앱 다운 수 이렇게 올리나봄ㅋㅋㅋ,3
2015년 11월 16일,"이거어떼의 기능을 많이 쓰는사람으로
이거어떼가 다른사람에게 알려주고 물건의 구매여부를 판단할수 있는 좋은 기능이다
하지만 이거어떼라고만하여 눌러보지 않고는 알수없어서 조그만한 카카오톡아이콘이나 이미지를 넣어줬으면 하는 아쉬움이 있다.",1
2015년 11월 14일,어플디자인좀바꿧으면좋겟어요 세련되게 ㅋㅋ,3
2015년 11월 11일,저장공간이 부족합니다. 구매내역 삭제 요청해주세요!,1
2015년 11월 11일,앱으로하니까 속도도 빠르고 편리하네요,1
2015년 11월 06일,자주사용하는데사용에대한메뉴편의성을 좀더 높여주세요 ㅜㅠ,1
2015년 11월 05일,"모바일 구매시 혜택이 많은거 같아요, 이벤트나 적립혜택도 다양하구요~ 편리해서 좋습니다.",1
2015년 10월 26일,주로 롯데닷컴에서 구매하는데 폰으로 쉽게 살 수 있어서 매우 편해요 그런데 구매포인트가 앱에선 안보여서 다시 확인해야해요,4
2015년 10월 23일,"계열사 통합 쇼핑 가능해서 편해요
그래도 다른 분들 리뷰에 적힌 단점들도 모두 공감되는 건 사실입니다.. 롯데닷컴때가 편하긴 햇쥬
그리고... 밤낮없이 앱 켜서 보는데",1
2015년 10월 22일,이번 기회에 설치했는데 편리하고 간편하고 빠르고해서 잘 사용하고 있습니다 역시 롯데닷컴이네요!!!,1
2015년 10월 17일,롯데닷컴을 앱에서도 접해봤는데 더욱편리하고 간편해서 사용하기 쉬워요,1
2015년 10월 17일,우선 반응속도가 너무나도 빨라서 좋아요,1
2015년 10월 15일,"모바일앱으로 사용하니 매일 자주 봐요^^인기특가전이나 서프라이즈...이벤트 내용들을 확인하기 편리하고 상세사진,설명등이 잘 되어있어 좋아요 !",5
2015년 10월 14일,괜찮네요 쿠폰덕에 저렴하게 잘구입했네요,1
2015년 10월 13일,"할부결제 지맘대로 일시불로 결제,
품절되니 전혀 다른상품 배송,
결제하니 포인트 전부 삭제
(2만점 가까이 버림)",1
2015년 10월 12일,원하는상품 검색하려 한참을 찾았는데 기능자체가없네요 일방적으로 보여주는 방식으론 개인취향대로 쇼핑을 할수가없죠 CJ GS가 훨씬 낫다는.... 기대하고 받았는데 실망!!,2
2015년 10월 11일,혜택많고 편리하다,1
2015년 10월 10일,"..앱 설치했는데 오류메세지라고
팝업만..
혹시나해서 지우고 다시깔아도...
안에 들어가보지도 못하고",1
2015년 10월 09일,쇼핑하기 진짜 편해졌어요!~^^ 모바일특가로 득템할때 기분이란 ㅎㅎ베리베리구우~웃!,1
2015년 09월 30일,롯데 계열이 많은데 가격을 좀 동일 하게 했으면 좋겠네요 어떨때는 롯데아이몰 어떨때는 엘롯데~~~ 그래서 여기저기 사는것이 좀 많이 아쉽네요,2
2015년 09월 29일,잼있네요^^   ‍   ‌,5
2015년 09월 25일,업데이트하고나서 지우고 다시 까는걸 반복해도 처음만 잘되구 들어갈수가 없어요. 껐다 켜봐도 계속 이러네요,1
2015년 09월 23일,"앱개발자분들은
쇼핑안하시나봐요
아니면
앱으로 쇼핑하는거를 막으려는 계획이신지",1
2015년 09월 18일,저장공간부족해서삭제부탁드려요,1
2015년 09월 13일,아이폰 용량 때문에 구매 목록 삭제 부탁드려요^^,1
2015년 09월 08일,로딩페이지에서 안넘어가네요..;,1
2015년 09월 06일,업뎃 후 어플 실행 안되요 후속 조치 급합니다,4
2015년 09월 06일,구매내역삭제바람,1
2015년 08월 24일,어떤카테고리에 들어가도 이불만 나옵니다. 이불장사만하나,2
2015년 08월 22일,신선합니다^^‍‍,1
2015년 08월 19일,"용량부족이네요
구매내역 삭제부탁드립니다.ㅠㅠ",1
2015년 08월 17일,결제하려고 넘어가면 하얀창만 뜨고 결제가 안되네요 빨리 조치 취해주세요 ㅡㅡ보니까 저만 그런게 아닌거같은데,1
2015년 08월 14일,용량이 부족하네요. 구매 내역 삭제좀 부탁드릴게요.,4
2015년 08월 03일,"주문하기 버튼 누르면 흰색으로 화면 바뀌면서 넘어가질 않아요.
앱 종료했다 다시 켜도 그렇든데
서버 문제라고 생각하기엔 너무 심해요",2
2015년 08월 03일,"매우 편리해요
굿!!!",1
2015년 07월 29일,구매내역 삭제 부탁드립니다,5
2015년 07월 14일,"롯데닷컴 앱은 무엇보다 구동이 빠르고 간편해서 좋아요 많은 쇼핑몰 앱들이 물건을 많이 노출시키기 위해 너무 복잡한 느낌을 주는데 롯데닷컴은 딱 필요한 카테고리를 찾기 쉽게 노출시켜 자유롭고 간편하게 쇼핑할수 있게 한답니다^^ 그리고 구동 속도는 타 쇼핑몰이 따라잡을수 없는 최대 장점이죠! 똑똑한 앱 롯데닷컴, 한번 체험해 보실라나요~?",5
2015년 06월 29일,롯데닷컴 앱을 이용하면 더 쉽고 빠르게 결제가 가능하더라구요! 잘만 이용하면 추가 적립이나 할인까지 되니 일석이조인거 같아요!,3
2015년 06월 22일,개발자분들도 비슷한거겠죠??,2
2015년 06월 11일,"장바구니 결제 오류 해결 좀 해주세요. 업데이트 후 앱에서 결제가 안되네요. ㅠㅅㅜ
쿠폰은 모바일앱용만 남았는데...",1
2015년 06월 06일,"스마트 픽같은거 따로 구분해줬으면 좋겠어요.
스마트픽 제품이어도 스파트픽이라고 명시 안되어있어서 조금 불편함이 다르네요.
그리고 물건 받고 나서 수취확인이나, 구매결정 버튼 만들어주세요.",1
2015년 06월 06일,구매 내역 삭제 부탁 드립니다,1
2015년 06월 04일,살기 좋은 세상ㅋ 자주 애용 할게요ㅋ,1
2015년 06월 02일,"편리하고
다른곳보다 가격도 저렴하고 좋아요",1
2015년 06월 01일,들어가지지도 않고 업데이트 표시는 계속 돌아가고 있고 아 거슬려죽겠어요 사용도 못하고잇고,1
2015년 05월 28일,업데이트하고 맨날 현재시간 화면에서 넘어간적 한번도 없고 튕겨나갔어요,1
2015년 04월 30일,별 하나도 아깝다 . 이렇게 결제에서 오류나고 엘포인트는 연동도 잘 안되고 이런 쓰레기앱을 만들었다고 출시하고 운영하고 있으니.. 만든 사람들 어디가서 본인이 앱 만들었다고 이야기하지마라 욕쳐먹는다,1
2015년 04월 24일,하눈에 들어와서 보기 편해요~~,1
2015년 04월 20일,결제 누르면 하얀화면으로 먹통되는 현상 어떻게 개선 안되나요? 그러려니하고 여러번 시도해서 했었는데 바쁠때 완전 완짜증!! 앱이 너무 버벅거려요.,1
2015년 04월 20일,폰용량때문에 구매목록삭제부탁드립니다ㅠㅠ,5
2015년 04월 18일,이벤트응모하는거랑 물건받고 리뷰작성하면 마일리지나 점수주는거 있음 좋겠어요,1
2015년 04월 18일,티비보다가 또는 잠자기전에 쇼핑하고 물건을 볼수 있는 점은 좋은데 결제를 하고 쇼핑완료를 하려면 카드결제하는 것도 복잡하고 상세정보가 피씨보다 부실해서 모바일로 결제까지 하는건 너무 어렵다.,2
2015년 04월 17일,같은 롯데계열 앱 중에서도 단연 최고인것 같습니다. 직관적인 ui로 메뉴 찾기도 쉽고 화면이동에 걸리는 시간도 빨라서 쇼핑하기에 좋습니다.,5
2015년 04월 05일,"좋은점 : 인터넷 브라우저 접속에 비해 속도가 빠르고 깔끔하고 심플하여 한눈에 들어오는 UI
아쉬운점 : 앱과 모바일홈페이지의 차이를 많이 느낄수가 없어서 굳이 앱을 받아야할 필요성을 느끼지 못함",5
2015년 04월 05일,"인터넷창으로 할때보다 접근성도 빠르고
결재까지 어렵지 않아요~*
모바일만의 추가해택도 있어서 앞으로 자주 애용할꺼 같네요",1
2015년 03월 11일,"장점은 구동이 빠르고 사용하기 편하다는 점
단점은 연계 쿠폰이 없다는 점",1
2015년 02월 27일,"무조건적인 소비자책임. 이전에 있던 케이스임에도 불구하고 어플오류 개선 생각없음. 여러분들 참고하세요.

얼마 전 물건을 주문했는데 오지 않아 배송을 확인해보니 배송지가 제가 주문한 곳과는 다른 곳으로 지정되어있네요. 분명 장바구니에 넣고 바로 주문하면 제가 설정한 기본 배송지로 설정되길래 따로 입력안하고 그냥 기본 배송지로 했습니다. 여기서 그렇다고 제가 배송지를 확인 안한것도 아닙니다. 제대로 확인했어요. 이러한 문제로 고객센터에 문의했더니 저희 쪽의 잘못이라고 하더군요. 네이버로 로그인하면 안되고 오로지 핸드폰 인증으로만 해야 가능하다고요. 뿐만 어니라 배송지가 오류 된 것이 당사자가 입력한 기본 배송지 설정과는 상관 없다. 고객님의 잘못이다 라고 말하더라고요. 계속 항의해봤자 저만 스트레스받아서 그만했습니다. 그리고 “배송물품 오류된 곳으로 물건 받아서 고객님께 갖다드리겠습니다.”하고 말씀하셔서 마무리 된 줄 알았으나, 저희집에 오늘 기사님이 와서 잘못된 택배를 받으러 오셨네요. 네 맞습니다. 잘못 간 배송지가 아닌 저희집에서 있지도 않은 택배를 찾은거죠. 잘못오신서 아니냐 뮬으니 오더가 그렇게 된거라고 확실하다고 하셨습니다. 끝까지 소비자의 책임을 하는 고객센터 개선부탁드립니다. 심지어 20.05월에 저와 똑같은 문제를 겪으신 분이 있네요. 무조건 소비자에게 책임을 전가하며 그럴 일이 없다고 하는 고객 상담사분을 통해 최근 oo전자에서 홈카메라 해킹 사건을 절대 그럴 일이 없다고 소비자 책임을 전가하며 나중에 기사화되자 사과한 일이 생각나는 서비스입니다.",3
2015년 02월 17일,구매내역 삭제부탁드려요~~,1
2015년 02월 11일,"백화점 브랜드 상품을 오프라인보다 저렴하게 살 수있어서 좋고, 직접 가보기 힘들때 좋아요~ㅋㅋ",1
2015년 02월 07일,업뎃 이후 더 편리하고 깔끔해요^^,1
2015년 02월 06일,인터넷보다는 힘드네요,1
2015년 02월 05일,"보기도 편하고 행사도 푸짐해서
쇼핑은 항상 롯데 닷컴 앱에서 하네요~",1
2015년 02월 04일,"아이폰 개발자 발로 개발했음??테스트 안하고 오픈함???
주문하기 클릭하면 하얀 화면만 나오고 안 됨
랜덤도 아니고 매번..쿠폰 월요일에 준다해서 이용하려면 주문하기 안됨..",1
2015년 02월 02일,상품평 올리기도 편리하고 롯데카드로 결제 할때도 간편해서 좋아요 ㅋ,1
2015년 02월 02일,계속 서버 오류임 만들지를 말던가 뭐임??,2
2015년 02월 01일,롯데온은 소비자를 골탕먹이려 앱을리뉴얼하신건지 등급혜택 다 없어지고 고객센터도 잘 안되군 앱은 허건날 로딩되구 아예화면이 사라지구 롯데관계자님 악덕기업주라 하고싶네요 너무너무 불편합니다 ?,1
2015년 01월 21일,피씨보다 좋네요,1
2015년 01월 20일,구매내역 삭제바랍니다.,1
2015년 01월 04일,주문페이지로 넘어가질 않네.,3
2015년 01월 03일,"아무리 삭제하고 다시 깔아도
꺼지네요..",1
2014년 12월 29일,구매목록 삭제 부탁드립니다.,1
2014년 12월 23일,"결제가안되요
화며시하얗게된다음 넘어가질않아요",1
2014년 12월 21일,구입 항목 삭제 요청합니다,1
2014년 12월 15일,언제 어디서나 간편하게 쇼핑할 수 있어 너무 좋습니다.게다가 할인율도 높고 각종 혜택들도 푸짐해서 너무 만족스러워요^^,1
2014년 12월 06일,모바일을 이렇게 지저분하게 하시다니... 로떼답습니당~ 백화점. 홈쇼핑 메뉴 또 있을거 앱은 왜 따로 있는지... 이상이상이상~~,1
2014년 11월 30일,어차피 Pc쓰니까 컴퓨터로 보고 모바일로 장바구니 들어가서 스마트페이로 결제하면 짱 편리함ㅋㅋㅋㅋ포인트도 더 많이 주고. 점점 괜찮아지는거 같음. 전 잘 쓰고 있어요.,3
2014년 11월 09일,"다른 쇼핑 어플은 전부 다 보여주려고 하는지 복잡하던데

롯데쇼핑은 여러개를 보여주려는 노력보다는 정돈된 카테고리와 상품 표현이 좋네요",1
2014년 11월 07일,"특가상품 같은게 메인에 눈에 잘 보이게 떠서 좋아요
그런데 좀 느린것 같아요",1
2014년 11월 06일,구매내역 삭제좀요.,1
2014년 11월 05일,쓰기편하고 사기도편하고~~~~,5
2014년 11월 04일,답답해서 설치하겠나 ㅋ,3
2014년 11월 01일,구매내역 삭제 부탁드립니다,1
2014년 10월 28일,"경쟁사 s회사의 쇼핑앱과 비교했을때 상당히 빠른 앱 속도에 만족스럽습니다
또한 빠른 메뉴라고 해야하나요 ?! 밑에 바 처럼 나오는 그 메뉴에 사용자가 자주 쓰는 장바구니 홈 스크랩 메뉴, 따로 마이메뉴에 들어가지 않고도 빠르게 배송조회를 할 수 있는 +버튼까지, 상당히 유용합니다",1
2014년 10월 24일,"가족,지인,친구와 ""이거어때""로 제품 공유하고 구매하거나 선물 하기 편리하더군요^^
특히 나 혼자 구매할때보다 쇼핑실패 확율이 줄어들어요.
선물할땐 상대방의 기호도 확인할 수 있어서 좋구요~",2
2014년 10월 22일,구매목록 삭제 부탁드려요.,1
2014년 10월 14일,"저에겐 아직도 이런 편하고 빠르고 손쉬운 세상이 너무 놀랍고 즐겁습니다.
제가 사용해본 경험으로는 아주 간결하고 사용하기 쉽습니다.
구입하고 싶은 물건이 정해져있고 상품명을 정확히 알고있거나 위시리스트에 물건이 담겨있을때는 아주아주 편합니다.",2
2014년 10월 09일,구매내역 삭제해주세요!,1
2014년 10월 01일,구매내역 삭제 부탁드려요,1
2014년 09월 29일,구매내역 삭제 부탁드려요,5
2014년 09월 24일,롯데닷컴 단골인데 친히 앱 버그 한 세가지를 고객센터에 알렸건만 어느 것 하나 한달이 다 되도록 수정이 안 되었다는 거~ 특가전 애서 상품보다가 특가전서브메인 다시 돌아가려면 홈에서 부터 다시 시작 해야한다는 단점있네요 버그를 즉시즉시 대응해줬음 좋겠음,3
2014년 09월 22일,"왜결제안됨?
어플 이상해짐",3
2014년 09월 14일,와- 롯데닷컴에 바로 연결하니 좋네요 ㅋ 매일 출석도장도 찍고! 여러 혜택 많이 받으세요!!,1
2014년 09월 05일,이럴꺼면 만들질 말던가,3
2014년 08월 13일,삭제바랍니다,1
2014년 08월 04일,주문상품배송확인하려는오늘깐어플이결제완료흔왜안열립니까 앱접속시계속튕깁니다...,2
2014년 07월 28일,"아니 롯데온 바뀌고 사용감 왤케 거지같죠?

1. 조건 정렬하고 검색 후 한 제품 들어가서 보고 백 하면 검색조건 초기화 되어버림",5
